doi,title,authors,affiliations,abstract,journal,published_date,crossref_type,url,source_issn,abs_journal_title,abs_field,abs_publisher,abs_ajg2024,abs_ajg2021,abs_ajg2018
10.1108/ijopm-10-2025-0994,Conflicting institutional logics in agricultural supply chain labour governance: the role of upstream agency,Muhammad Khan; Michael Rogerson; Dimitrios Papadas; Karl Behrendt; Lydia Arnold,"Harper Adams University , ,; University of Sussex Business School, University of Sussex , ,; Harokopio University of Athens , ,","Purpose This article investigates the institutional logics affecting labour governance upstream in agrifood supply chains. It focuses on the lived experience of farming communities in Pakistan, their agency and the implications for top-down governance of labour exploitation. Design/methodology/approach A qualitative approach comprising 48 interviews and 10 focus groups, with 73 total respondents, was employed. Data were analyzed using thematic analysis to understand how governance efforts were understood and experienced. Findings The study identifies the logics at play. Conflicts were found both in the top-down governance and market logics imposed on farming communities and between those logics and factors informing a local “social logic”. The complexity of these conflicts and resistance among farming communities induce what we term a “messy paralysis” of governance. Communities exercised their agency to resist top-down governance efforts, which they see as imposed on them. Research limitations/implications Labour and wider governance efforts that are not co-designed with their subject communities are likely to conflict with local values, reducing their impact and failing to protect workers' well-being and corporate reputation. Originality/value The upstream approach taken, and its link with global labour governance approaches, is rare in the operations and supply chain management literature. The article provides rich insights which both build upon and problematize extant labour governance research.",International Journal of Operations &amp; Production Management,2026-06-16,journal-article,https://doi.org/10.1108/ijopm-10-2025-0994,1758-6593,International Journal of Operations and Production Management,OPS&TECH,Emerald,4,4,4
10.1177/01492063261448817,"Crises Unbound: Institutions, Occupational Groups, and the Construction of Omnicrises",Gerardo Patriotta; Maxim Voronov,University of Bath; York University,"Omnicrises are systemic disruptions that transcend organizational boundaries, rapidly escalating across institutional domains and destabilizing the jurisdictional order through which social life is coordinated. Unlike conventional crises that are confined to specific organizations or industries, an omnicrisis triggers a state of jurisdictional fracturing, creating vacuums of authority that undermine communities’ sense of stability and continuity. We argue that omnicrises occur when systemic disruptions misalign established connections between occupational mandates, settled jurisdictions, and recognized expertise, compelling occupational groups to avow, delegate, or realign authority in response to unfolding threats. Resolution emerges through processes of institutional repair that stabilize a coherent jurisdictional settlement and enable the construction of a “new normal.” By incorporating insights from institutional theory and the sociology of occupations, we advance understanding of crisis governance, expertise under systemic threat, and the reconstruction of institutional order in an era of pervasive uncertainty.",Journal of Management,2026-06-15,journal-article,https://doi.org/10.1177/01492063261448817,1557-1211,Journal of Management,ETHICS-CSR-MAN,SAGE,4*,4*,4*
10.1111/risa.70284,Can Large Language Models Reason Strategically? Evidence From Attacker–Defender Signaling Games,Sabiha Unal Eyi; Jun Zhuang,Department of Industrial and Systems Engineering University at Buffalo Buffalo New York USA,"ABSTRACT Large language models (LLMs) are increasingly considered for deployment in applications requiring strategic judgment under uncertainty. Yet it remains unclear whether their behavior in adversarial environments resembles normative decision‐making, human strategic behavior, or something qualitatively distinct from both. This study addresses that question using a controlled attacker–defender signaling game in which an attacker must interpret potentially deceptive defender announcements and decide whether to attack one of two targets or abstain. We develop a three‐way comparison framework that evaluates GPT‐4o against two benchmarks simultaneously: a normative Bayesian best‐response model and empirical human decisions drawn from a matched experimental data set. Critically, we decompose strategic behavior into two components, belief formation and action selection, to identify whether similarities and divergences across agent types arise at the level of probabilistic inference, behavioral choice, or both. The results provide partial support for normative alignment (H1): GPT‐4o's modal action matches the normative benchmark in seven out of eight scenarios, yet its decision distributions diverge significantly in all conditions (), driven by a systematic underutilization of the abort option (6.7% vs. the normative recommendation of 25.6%). Human similarity (H2) is not supported, with action frequency distributions differing significantly across all eight conditions (). The core finding is a cognitive‐action decoupling: GPT‐4o maintains more diffuse posterior beliefs than humans in six out of eight scenarios yet produces more deterministic actions, and explicitly articulates uncertainty in 14%–28% of reasoning traces while systematically overriding that uncertainty in its final decisions. These findings position current LLMs as a strategically distinct class of agent, neither fully rational equilibrium players nor behavioral mimics of human bounded rationality. The observed commission bias and belief‐action decoupling have direct implications for the deployment of LLMs in high‐stakes adversarial roles, where abstention under uncertainty is often the strategically rational choice.",Risk Analysis,2026-06-15,journal-article,https://doi.org/10.1111/risa.70284,1539-6924,Risk Analysis,SOC SCI,Wiley-Blackwell,4,4,4
10.1177/10944281261443052,Rhythms of Organizational Life: Rhythmanalysis as an Organizational Research Method,Albane Grandazzi; Gazi Islam,"Grenoble Ecole de Management,; Grenoble Ecole de Management and IREGE","Rhythms form an essential part of organizational life, involving embodied patterns of repetition and difference that structure work processes, against the ongoing background of wider organizational and environmental rhythms. Organizational literature increasingly recognizes the importance of rhythms; yet little methodological work exists, either at the level of theorization or practical guidance. The current study draws on Lefebvre's foundational work on rhythmanalysis to elaborate an organizational methodology for studying rhythms. We argue that rhythmanalysis provides a critically oriented approach to understanding social dynamics and advances theorizing about organizational environments by overcoming the dichotomy between entities and processes, stability and change. In this article, we propose methodological guidelines for developing the field of rhythmanalysis in organizational settings by illustrating how it can be conducted through the reanalysis of ethnographic material. We discuss the methodological contributions of rhythmanalysis for a critical exploration of organizational dynamics.",Organizational Research Methods,2026-06-15,journal-article,https://doi.org/10.1177/10944281261443052,1552-7425,Organizational Research Methods,ORG STUD,SAGE,4,4,4
10.1093/jrsssb/qkag093,"Mei Dong, Linbo Wang, Lin Liu, and Oliver Dukes's contribution to the Discussion of ‘Regression by composition’ by Farewell et al",Mei Dong; Linbo Wang; Lin Liu; Oliver Dukes,"Division of Biostatistics, University of Toronto , Toronto ,; Department of Statistical Sciences, University of Toronto , Toronto ,; Institute of Natural Sciences, Shanghai Jiao Tong University , Shanghai ,; Department of Mathematics, Computer Science, and Statistics, Ghent University , Ghent ,",,Journal of the Royal Statistical Society Series B: Statistical Methodology,2026-06-15,journal-article,https://doi.org/10.1093/jrsssb/qkag093,1467-9868,Journal of the Royal Statistical Society. Series B: Statistical Methodology,ECON,Wiley-Blackwell,4,4,4
10.1093/jrsssb/qkag092,"Maozai Tian, Wei Xiong, Shaopei Ma, and Jinwen Liang's Contribution to the Discussion of ‘Regression by Composition’ by Farewell et al",Maozai Tian; Wei Xiong; Shaopei Ma; Jinwen Liang,"Center for Applied Statistics, School of Statistics, Renmin University of China , Beijing 100872 ,; School of Statistics and Data Science, Xinjiang University of Finance and Economics , Urumqi 830012 ,; Department of Mathematics and Data Science, Changji University , hangji 831100 ,; School of Statistics, University of International Business and Economics , Beijing 100105 ,; School of Mathematics, Statistics and Mechanics, Beijing University of Technology , Beijing 100872 ,",,Journal of the Royal Statistical Society Series B: Statistical Methodology,2026-06-15,journal-article,https://doi.org/10.1093/jrsssb/qkag092,1467-9868,Journal of the Royal Statistical Society. Series B: Statistical Methodology,ECON,Wiley-Blackwell,4,4,4
10.1093/jrsssb/qkag097,Cheng et al's contribution to the Discussion of ‘Regression by composition’ by Farewell et al,Kaiming Cheng; Rong Jiang; Jiangfeng Wang; Keming Yu,"School of Statistics and Data Science, Zhejiang Gongshang University , Hangzhou ,; Laboratory for Statistical Monitoring and Intelligent Governance of Common Prosperity , Hangzhou ,; School of Statistics and Data Science, Shanghai University of International Business and Economics , Shanghai ,; Department of Mathematics, Brunel University of London , London ,",,Journal of the Royal Statistical Society Series B: Statistical Methodology,2026-06-15,journal-article,https://doi.org/10.1093/jrsssb/qkag097,1467-9868,Journal of the Royal Statistical Society. Series B: Statistical Methodology,ECON,Wiley-Blackwell,4,4,4
10.1093/jrsssb/qkag094,Archer Gong Zhang's contribution to the Discussion of ‘Regression by composition’ by Farewell et al,Archer Gong Zhang,"School of Mathematics and Statistics, University of Glasgow",,Journal of the Royal Statistical Society Series B: Statistical Methodology,2026-06-15,journal-article,https://doi.org/10.1093/jrsssb/qkag094,1467-9868,Journal of the Royal Statistical Society. Series B: Statistical Methodology,ECON,Wiley-Blackwell,4,4,4
10.1093/jrsssb/qkag086,Andi Wang's contribution to the Discussion of ‘Regression by composition’ by Farewell et al,Andi Q Wang,University of Warwick,,Journal of the Royal Statistical Society Series B: Statistical Methodology,2026-06-15,journal-article,https://doi.org/10.1093/jrsssb/qkag086,1467-9868,Journal of the Royal Statistical Society. Series B: Statistical Methodology,ECON,Wiley-Blackwell,4,4,4
10.1111/iere.70079,Entry and Welfare in General Equilibrium With Heterogeneous Firms and Endogenous Markups,Kyle Bagwell; Seung Hoon Lee,"Department of Economics Stanford University, Stanford, California USA; NBER USA; School of Economics Yonsei University Seoul South Korea","ABSTRACT We analyze market entry efficiency in single‐ and two‐sector closed‐economy Melitz–Ottaviano (MO) models without an outside good. Comparing market and second‐best outcomes, we find that market entry is efficient in the single‐sector model. This efficiency also holds in a symmetric two‐sector setting. When sectors have asymmetric demand and the level of asymmetry is sufficiently small, the market yields excessive entry into the “high‐demand” sector. This inefficiency arises from the presence of an additional aggregator in MO preferences.",International Economic Review,2026-06-15,journal-article,https://doi.org/10.1111/iere.70079,1468-2354,International Economic Review,ECON,Wiley-Blackwell,4,4,4
10.1111/1467-8551.70088,Collaborating with Competitors Across Domestic and International Markets,James M. Crick; David Crick,Waikato Management School University of Waikato 101 Durham Street Tauranga 3110 New Zealand; Telfer School of Management University of Ottawa 55 Laurier Avenue East Ottawa Ontario K1N6N5 Canada,"Abstract Since small enterprises face diverse opportunities and challenges across their domestic and international markets, coopetition (cooperation among competitors) could have different performance outcomes and boundary conditions in these arenas. Therefore, guided by resource‐based theory (RBT), this study unpacks the coopetition–small‐firm performance relationship in domestic and international markets. Two phases of survey data were collected from small wine producers in New Zealand, respectively examining domestic and international coopetition activities. The results showed that domestic coopetition negatively affects small‐firm performance, but competitive intensity positively moderates this link. In contrast, international coopetition positively impacts small‐firm performance while competitive intensity negatively influences this association. Subsequently, qualitative evidence was utilized to explain the counter‐intuitive quantitative findings. Collectively, this study contributes to the strategic management literature with unique insights about the varied performance outcomes and boundary conditions of coopetition across domestic and international markets. This investigation also advances the extended facets of RBT (inside‐the‐firm factors, alongside issues pertaining to environmental forces and stakeholder relationships) as a lens for conceptualizing coopetition domestically and internationally.",British Journal of Management,2026-06-15,journal-article,https://doi.org/10.1111/1467-8551.70088,1467-8551,British Journal of Management,ETHICS-CSR-MAN,Wiley-Blackwell,4,4,4
10.1080/02678373.2026.2688766,Does better sleep quality always predict better work performance? A daily examination of sleep quality and task proactivity,Alexandra A. Henderson; Larissa K. Barber; Xinyu Judy Hu,Zayed University; San Diego State University; Roger Williams University,,Work &amp; Stress,2026-06-14,journal-article,https://doi.org/10.1080/02678373.2026.2688766,1464-5335,Work and Stress,PSYCH (WOP-OB),Taylor & Francis,4,4,3.0
10.1111/joms.70120,Moralized Identities in and Around Organizations: An Identity Work Perspective,Michael J. Gill; Andrew D. Brown,University of Oxford; University of Bath,"Abstract In this article, we examine the literature on moralized identities – the range of identities that people construct for themselves that are underpinned by issues of morality. We problematize traditional theorizing by drawing on the identity work perspective to provide an explanatory framework that diverts attention away from a focus on what single, stable, unified, and rarely fully contextualized moralized identities do to theorize how multiple, fluid, context‐specific, moralized identities embedded in relations of power develop . Our framework outlines a dynamic conceptualization of moralized identities which disrupts the assumption of moral coherence by theorizing moralized identities as plural, dynamic, relational, and networked. Building on our framework, we provide an agenda for future moralized identities research.",Journal of Management Studies,2026-06-14,journal-article,https://doi.org/10.1111/joms.70120,1467-6486,Journal of Management Studies,ETHICS-CSR-MAN,Wiley-Blackwell,4,4,4
10.1111/joms.70104,"Chasing – Or Escaping – The Limelight of Sustainability Media Attention? Narcissism's Opposing Effects for Women and Men
                    <scp>CEOs</scp>
                    on Environmental Performance",Jamie L. Gloor; Sana Chiu; Judith Walls; Giannina Faktor,"University of St.Gallen; University of Houston; New Environmental School, Tel Aviv University","Abstract According to strategy research, firms with more narcissistic CEOs and firms with women CEOs exhibit better environmental performance (EP); however, we propose that better EP is un expected when jointly considering these characteristics. Although positive attention theoretically drives more narcissistic CEOs' EP, by considering the gendered factors influencing CEO cognition and behaviour, we propose that this effect reverses for women. We develop and validate a novel, earnings‐call‐based machine learning measure of CEO narcissism (which we also compare with existing measures by Chatterjee and Hambrick 2011, Administrative Science Quarterly , 56, 202–207 and Petrenko et al. 2016, Strategic Management Journal , 37, 262–79) to test how CEO sex, narcissism, and positive attention shape EP. We triangulate evidence supporting our hypotheses from S&P 1500 firm panel data (Study 1) and an experiment with strategic leaders (Study 2): when EP generates more positive media attention, more narcissism negatively (positively) affects EP with women (men) leaders. Advancing a more precise understanding of how CEO narcissism affects EP for men and women CEOs, we explain the mixed effects of CEO narcissism and CEO sex in separately developing literatures; we also contribute to the microfoundations of (environmental) strategy with important implications for scholarship and practice while also mitigating measurement constraints in understanding the relations between CEO narcissism and firm action.",Journal of Management Studies,2026-06-14,journal-article,https://doi.org/10.1111/joms.70104,1467-6486,Journal of Management Studies,ETHICS-CSR-MAN,Wiley-Blackwell,4,4,4
10.1093/ej/ueag077,Resisting Populism through Financial Market Exposure: Experimental Evidence from Brexit,Saumitra Jha,Stanford Graduate School of Business,"Abstract Populism has been on the rise, posing a threat to liberal democracy. Existing evidence suggests that globalization, economic shocks, and concerns over cultural change increase support for populist agendas. Yet less is known about interventions that can empower individuals to critically evaluate populist messaging. We argue that tailored exposure to financial markets can reduce support for populist policies because it can encourage learning about the gains of economic complementarity and the costs of nativism and isolationism. We test this argument with an RCT implemented in the run-up to the Brexit referendum. We randomly assigned British citizens to hold and trade complementary financial assets from the UK, EU and the US for six weeks. We show that this intervention increased citizens’ willingness to vote to remain in the European Union during the Brexit Referendum, and particularly so when exposed to companies that exemplify EU-UK economic complementarity. Countering populist narratives, treated participants instead came to associate the EU with economic prosperity, rather than a threat to their cultural identity or a waste of money. Overall, the effects are stronger among swing participants and those originally more open to a European cultural identity.",The Economic Journal,2026-06-13,journal-article,https://doi.org/10.1093/ej/ueag077,1468-0297,Economic Journal,ECON,Wiley-Blackwell,4,4,4
10.1007/s10107-026-02377-7,Optimized methods for composite optimization: a reduction perspective,Jinho Bok; Jason M. Altschuler,,"Abstract Recent advances in convex optimization have leveraged computer-assisted proofs to develop optimized first-order methods that improve over classical algorithms. However, each optimized method is specially tailored for a particular problem setting, and it is a well-documented challenge to extend optimized methods to other settings due to their highly bespoke design and analysis. We provide a framework that derives optimized methods for composite optimization directly from those for unconstrained smooth optimization. The derived methods naturally extend the original methods, analogous to how proximal gradient descent extends gradient descent. The key to our result is certain algebraic identities that—by leveraging a common structure of optimized methods— provide a unified way of extending convergence analyses from unconstrained to composite settings. As concrete examples, we apply our framework to establish (1) the phenomenon of stepsize acceleration for proximal gradients descent; (2) a convergence rate for the proximal optimized gradient method [2] which is faster than FISTA [3]; (3) a new method that improves the state-of-the-art rate for minimizing gradient norm in the composite setting.",Mathematical Programming,2026-06-13,journal-article,https://doi.org/10.1007/s10107-026-02377-7,1436-4646,Mathematical Programming,OR&MANSCI,Springer Nature,4,4,4
10.1093/jrsssb/qkag085,"Si-Yang Li, David van Dyk and Maximilian Autenreith's contribution to the Discussion of ‘Regression by composition’ by Farewell et al",Si-Yang Li; David A van Dyk; Maximilian Autenrieth,"Department of Mathematics, Imperial College London , 180 Queen's Gate, London SW7 2AZ ,; Statistical Laboratory, University of Cambridge , Wilberforce Road, Cambridge CB3 0WB ,",,Journal of the Royal Statistical Society Series B: Statistical Methodology,2026-06-13,journal-article,https://doi.org/10.1093/jrsssb/qkag085,1467-9868,Journal of the Royal Statistical Society. Series B: Statistical Methodology,ECON,Wiley-Blackwell,4,4,4
