doi,title,authors,affiliations,abstract,journal,published_date,crossref_type,url,source_issn,abs_journal_title,abs_field,abs_publisher,abs_ajg2024,abs_ajg2021,abs_ajg2018
10.1162/rest.a.1830,The Effects of Social Movements: Evidence from #MeToo,Ro’ee Levy; Martin Mattsson,Tel Aviv University and CEPR roee.levy@tauex.tau.ac.il; National University of Singapore martin.mattsson@nus.edu.sg,"Abstract We study the effect of the MeToo movement on reports of sex crimes to the police. Using multiple empirical strategies, including a triple-difference design comparing crime types across countries and over time, we find that the movement increased reported sex crimes by approximately 10%. Analyzing incident-level US data, we find that the movement also increased arrests and had similar effects across racial and socioeconomic groups. The evidence suggests that the increase reflects a higher propensity to report sex crimes rather than an increase in their incidence. Our results demonstrate that social movements can rapidly and persistently change high-stakes personal decisions.",Review of Economics and Statistics,2026-07-21,journal-article,https://doi.org/10.1162/rest.a.1830,1530-9142,Review of Economics and Statistics,ECON,MIT Press,4,4,4
10.1162/rest.a.1835,The Bronx Is Burning: Urban Disinvestment Effects of Fair Access to Insurance Requirements Plans,Ingrid Gould Ellen; Daniel A. Hartley; Jeffrey Lin; Wei You,New York University ingrid.ellen@nyu.edu; Federal Reserve Bank of Chicago daniel.a.hartley@chi.frb.org; Federal Reserve Bank of Philadelphia jeff.lin@phil.frb.org; Peking University weiyou@nsd.pku.edu.cn,"Abstract We study the unintended effects of Fair Access to Insurance Requirements (FAIR) plans developed by 26 states in the 1960s to address insurance redlining in urban neighborhoods. FAIR plans’ problematic features included prohibitions on considering environmental hazards in underwriting, mandatory insurer participation in pools that diluted underwriting incentives, and payouts exceeding market values in declining areas. Using a triple-difference design comparing pre/post-FAIR periods, neighborhoods with/without likely FAIR access, and participating/non-participating states, we find that FAIR inadvertently led to significant housing disinvestment and accelerated declines in neighborhood population, with simultaneous increases in the Black population share.",Review of Economics and Statistics,2026-07-21,journal-article,https://doi.org/10.1162/rest.a.1835,1530-9142,Review of Economics and Statistics,ECON,MIT Press,4,4,4
10.1162/rest.a.1837,Synthetic Controls for Experimental Design,Alberto Abadie; Jinglong Zhao,"Department of Economics, MIT abadie@mit.edu; Questrom School of Business, Boston University jinglong@bu.edu","Abstract This paper studies how to design experiments when the experimental units are large aggregate entities (e.g., markets), and only one or a small number of units can be treated. We propose a class of non-randomized experimental designs using the synthetic control method, which jointly selects treated units and untreated units to serve as a comparison group. We analyze the properties of estimators under these synthetic control designs and develop new inferential techniques. We show that, in experiments with aggregate units, synthetic control designs can substantially reduce estimation bias relative to randomized experiments.",Review of Economics and Statistics,2026-07-21,journal-article,https://doi.org/10.1162/rest.a.1837,1530-9142,Review of Economics and Statistics,ECON,MIT Press,4,4,4
10.1162/rest.a.1834,Outside Income as a Signal: Evidence from Politicians and Voters,Carina Neisser; Nils Wehrhöfer,University of Cologne and IZA neisser@wiso.uni-koeln.de; Deutsche Bundesbank and ZEW nils.wehrhoefer@bundesbank.de,"Abstract We study how public disclosure of politicians’ outside income affects their behavior. We exploit a disclosure reform targeting German federal MPs and tax-return data in a difference-indifferences setup using unaffected state MPs as controls. MPs increase their outside income by 24%, driven by likely right-leaning MPs. A representative survey experiment uncovers that right-leaning voters interpret outside income as a signal of competence and hard work, while left-leaning voters associate it with weaker representation. Consistent with this, we show that newspapers cover right-leaning MPs’ outside activities more favorably. Our findings suggest that politicians strategically use public disclosure as a signaling tool.",Review of Economics and Statistics,2026-07-21,journal-article,https://doi.org/10.1162/rest.a.1834,1530-9142,Review of Economics and Statistics,ECON,MIT Press,4,4,4
10.1162/rest.a.1832,Fiscal Policy in Small Open Economies: The International Intertemporal Keynesian Cross,Jacob Sundram,"Department of Economics, University of Copenhagen, 1353 København K, Denmark jacobmsundram@gmail.com","Abstract A recent literature studies fiscal policy with realistic intertemporal marginal propensities to consume and the absence of Ricardian equivalence. This literature shows that fiscal policy boosts consumption and is effective: (i) Cumulative fiscal multipliers are above one, and (ii) fiscal policy is fully self-financing. I show this does not extend to small open economies by providing conditions where (i) the cumulative fiscal multiplier is exactly one, and (ii) fiscal deficits are not fully self-financing. This is because the initial debt-fueled rise in consumption is offset by a drop to repay foreign debt. Finally, I provide conditions to overturn this result.",Review of Economics and Statistics,2026-07-21,journal-article,https://doi.org/10.1162/rest.a.1832,1530-9142,Review of Economics and Statistics,ECON,MIT Press,4,4,4
10.1162/rest.a.1831,Firm Concentration and Job Design: The Case of Schedule Flexible Work Arrangements,Abi Adams; Maria Balgova; Matthias Qian; Tom Waters,Northwestern University abigail.adams@northwestern.edu; Bank of England maria.balgova@bankofengland.co.uk; ESMT Berlin matthias.qian@esmt.org; IFS tom w@ifs.org.uk,"Abstract We study how employer concentration affects job design, focusing on schedule flexibility as a non-wage job attribute. Using the full text of 46 million UK job vacancies from 2014–2019, we construct new measures of flexible work arrangements using supervised machine learning and large-language-model—assisted annotations. Adopting an instrumental variable strategy using a Bartik-style prediction of the change in employer concentration based on nationwide hiring trends, we show that higher concentration reduces the value of worker compensation partly through shifts toward “risky” flexibility that exposes workers to earnings volatility.",Review of Economics and Statistics,2026-07-21,journal-article,https://doi.org/10.1162/rest.a.1831,1530-9142,Review of Economics and Statistics,ECON,MIT Press,4,4,4
10.1162/rest.a.1829,Excessive Pharmaceutical Marketing Expenditure: Policy Remedies from China,Chenyuan Liu; Yi Lu; Wanyu Yang,"School of Economics and Management, Tsinghua University, Beijing, 100084, China liuchy3@sem.tsinghua.edu.cn; School of Economics and Management, Tsinghua University, Beijing, 100084, China luyi@sem.tsinghua.edu.cn; Center for Industrial and Business Organization and Institute for Advanced Economic Research, Dongbei University of Finance and Economics, 116025, China wanyu.yang@dufe.edu.cn","Abstract Developing countries face high pharmaceutical prices despite the presence of multiple generic producers. One key reason is excessive spending on sales and marketing by drug firms. This paper examines how centralized drug procurement can curb such marketing efforts and reduce prices, using a policy experiment in China where certain generics are procured through centralized auctions in pilot cities. Winning firms gain large market shares directly without high marketing costs. We find that the centralized auction significantly reduces both sales costs and prices, with winning firms experiencing notable decreases in marketing-related labor demand.",Review of Economics and Statistics,2026-07-21,journal-article,https://doi.org/10.1162/rest.a.1829,1530-9142,Review of Economics and Statistics,ECON,MIT Press,4,4,4
10.1162/rest.a.1839,Does a Food Waste Tax Work? Evidence from Quasi-Experiments in South Korea,Seunghoon Lee,"Department of Economics, University of Missouri seunghoon.lee@missouri.edu","Abstract Globally, one-third of food is discarded, generating lifecycle greenhouse gas emissions comparable to those from road transport. Further, waste management is among the largest municipal budget items worldwide. Exploiting plausibly exogenous unit-based food waste tax expansions in South Korea, I find that the tax substantially reduces food waste by discouraging excessive grocery purchases. Households sustain food intake despite buying less, but at the cost of additional time spent on meal production. Nonpecuniary motivations appear central to the policy’s e!ectiveness, and the tax is likely welfare-improving because more e""cient food use not only reduces externalities but also offsets time costs.",Review of Economics and Statistics,2026-07-21,journal-article,https://doi.org/10.1162/rest.a.1839,1530-9142,Review of Economics and Statistics,ECON,MIT Press,4,4,4
10.1162/rest.a.1838,Do Health Insurers Matter for Health Outcomes? Evidence from a Large Natural Experiment in Colombia,Giancarlo Buitrago; Paul Rodríguez-Lesmes; Natalia Serna; Marcos Vera-Hernández,"Universidad Nacional de Colombia, Fundacion Cardioinfantil; Universidad del Rosario; Stanford University; University College London, IFS, CEPR","Abstract While the relationship between health insurance coverage and health outcomes has been extensively studied, there is limited evidence on which specific features of insurance matter. We address this gap by leveraging the abrupt termination of Colombia’s largest health insurer and examining the spillover effects on patients who were not enrolled with the terminated insurer. The termination caused a 10% decrease in the breadth of provider networks among incumbent insurers and a 20% increase in mortality rates. We show two mechanisms drove the change in mortality: increased congestion stemming from the surge of enrollees at incumbent insurers and reduced provider network breadth. Insurers narrowed their networks by excluding higher-quality providers that served sicker, more expensive patients, whoin turn died at much higher rates than their counterparts. Findings suggest insurers play a key role in patient health through their provider networks.",Review of Economics and Statistics,2026-07-21,journal-article,https://doi.org/10.1162/rest.a.1838,1530-9142,Review of Economics and Statistics,ECON,MIT Press,4,4,4
10.1080/01621459.2026.2688950,Scalable Bayesian Inference for Time Series via Divide and Conquer,Rihui Ou; Lachlan Astfalck; Deborshee Sen; David Dunson,"Department of Statistical Science, Duke University; School of Mathematics and Statistics, University of New South Wales; School of Physics, Mathematics and Computation, The University of Western Australia",,Journal of the American Statistical Association,2026-07-21,journal-article,https://doi.org/10.1080/01621459.2026.2688950,1537-274X,Journal of the American Statistical Association,ECON,Taylor & Francis,4,4,4
10.1002/job.70116,An Unattainable Emotional Advantage? Supervisors' Perceptual Biases in the Relationship Between Emotional Understanding Ability and Performance Ratings for Female Employees,Hanbo Shim; Myeong‐Gu Seo; Joo Hun Han; Sirkwoo Jin,"Department of Management, College of Business The University of Texas at Arlington Arlington Texas USA; Department of Management and Organization, Robert H. Smith School of Business University of Maryland College Park Maryland USA; Department of Management Engineering, College of Business Korea Advanced Institute of Science and Technology (KAIST) Seoul South Korea; Management, Marketing and Sport Management Division, Girard School of Business, Merrick College North Andover Massachusetts USA","ABSTRACT Empathy is increasingly valued at workplaces as it facilitates interpersonal relationships, collaboration, and team functioning. Accordingly, organizations increasingly observe and recognize employees' emotional understanding (EU) ability—a key foundation of empathy—as an important dimension of individual merit in performance evaluations. We note that, however, supervisors' gender stereotypes may constrain whether EU ability is recognized properly, particularly for female employees. Drawing on dual‐process models of social cognition, we theorized that the female empathy stereotype—the belief that women are inherently more empathetic than men—leads supervisors to attribute female employees' EU ability to gender‐typical traits rather than to individual merit. As a result, the supervisors' female empathy stereotype weakens the link between observed emotional intelligence (EI) ability and job performance ratings. Across a video vignette experiment (Study 1) and a field study (Study 2), we found that the relationship between supervisors' perceptions of EU ability and their ratings of job performance was consistently weaker for female than for male employees. We conducted another vignette experiment (Study 3) to test three‐way interactions with two moderators (i.e., employee gender and raters' female empathy stereotype) and found that supervisors' female empathy stereotype attenuated the relationship for female employees but not for males. Our findings extend research on gender stereotypes, empathy, and EI by demonstrating how a widely shared gender stereotype can discount female employees' valuable emotional abilities.",Journal of Organizational Behavior,2026-07-21,journal-article,https://doi.org/10.1002/job.70116,1099-1379,Journal of Organizational Behavior,PSYCH (WOP-OB),Wiley-Blackwell,4,4,4
10.1111/joms.70141,Beyond Quality and Quantity: Enriching the Study of Organizational Attention,Davide Nicolini; Matthew Hurst; Jeanne Mengis; Manuel Baeriswyl,Warwick Business School; BI Oslo; Università della Svizzera italiana,"Abstract This Counterpoint advances the study of organizational attention by proposing an ‘expansive’ rather than a ‘substitutive’ development of the attention‐based view (ABV) as proposed in the Point . While endorsing a richer understanding of attention, we caution against reinforcing unhelpful dichotomies between quality and quantity of attention. We argue that the ABV's perceived limitations, especially its treatment of attention as scarce and quantifiable, reflect Simon's legacy more than flaws in the ABV itself. We propose three directions for future research: rethinking resource allocation as emerging from competition among attentional sources; developing a thicker view of situatedness in which social dynamics shape attention beyond intentionality; and revisiting scarcity by examining why attention is limited, what kind of scarcity is involved, and when abundance rather than scarcity becomes problematic. By articulating a dialectical position that transcends the thesis of a complete turn to the quality of attending, as in the Point and the antithesis in Counterpoint 2 – stick to quantity and persevere in normal science, we offer a way forward that preserves the strengths of attentional research while enabling a more nuanced account of organizational attention.",Journal of Management Studies,2026-07-21,journal-article,https://doi.org/10.1111/joms.70141,1467-6486,Journal of Management Studies,ETHICS-CSR-MAN,Wiley-Blackwell,4,4,4
10.1080/07350015.2026.2707220,Asymptotic Distributions of Nonlinear Least Squares Estimators for Panel-MIDAS Models,Min Lin; Han Lin,"Bay Area International Business School, Beijing Normal University; University of Exeter Business School, University of Exeter",,Journal of Business &amp; Economic Statistics,2026-07-21,journal-article,https://doi.org/10.1080/07350015.2026.2707220,1537-2707,Journal of Business and Economic Statistics,ECON,Taylor & Francis,4,4,4
10.1080/00076791.2026.2703421,"<b>
                      <i>
                        Les stratégies commerciales de hennessy, de la fin du XVIII
                        <sup>e</sup>
                        siècle au début du XX
                        <sup>e</sup>
                        siècle. La construction de la réputation, de la qualité et de la marque du cognac
                      </i>
                    </b>",Hubert Bonin,"Sciences Po Bordeaux et BxSE-Bordeaux Sciences Économiques, Université de Bordeaux",,Business History,2026-07-21,journal-article,https://doi.org/10.1080/00076791.2026.2703421,1743-7938,Business History,BUS HIST & ECON HIST,Taylor & Francis,4,4,3.0
10.1111/1467-8551.70096,From Cutting Edges to the Cutting Edge: Knowing and Theorizing Through Collage Inquiry,Georgia Stavraki; Emmanuella Plakoyiannaki; Lena J. Jaspersen,"Department of Organisation Management, Marketing and Tourism International Hellenic University Thessaloniki 57400 Greece; Department of Marketing and International Business, Faculty of Business, Economics and Statistics University of Vienna Oskar‐Morgenstern‐Platz 1 Vienna 1090 Austria; Management and Organisations Department, Leeds University Business School, Maurice Keyworth Building University of Leeds Leeds LS2 9JT UK","Abstract Prompted by ongoing debates about the need for more novel and pluralistic management research, this paper explores the different ways of researching, knowing and theorizing emerging from the arts‐based method of collage inquiry. We used a problematizing approach to examine how collage inquiry has been used in management research and neighbouring disciplines with the aim of unpacking its potential for relevant scholarship. We advance a typology of five approaches taken to collage inquiry: collage as projection , as triangulation , as sensemaking , as negotiation and as art . The typology links research motivation, ontological and epistemological assumptions, process of collage creation and interpretation, the role of the researcher in the process, data collection and analysis, emerging meanings and different ways of knowing, theorizing and assessing rigorously from collage inquiry. It clarifies when collage supports incremental extension and when—and how—it enables more imaginative, disruptive contributions. In doing so, we contribute to the broader management community, namely researchers, reviewers and editors, by showing that different uses of collage inquiry rest on different assumptions and therefore enable different forms of knowing and theorizing, as well as require different criteria for evaluation.",British Journal of Management,2026-07-21,journal-article,https://doi.org/10.1111/1467-8551.70096,1467-8551,British Journal of Management,ETHICS-CSR-MAN,Wiley-Blackwell,4,4,4
